### ISSUE TITLE
500s replaced with 504s since v0.10.16

### ISSUE THREAD

**Issue by mikkeloscar** [zalando/skipper#687]
Putting this here to not forget about it..

I have a suspicion that we may be "hiding" some errors since introducing: https://github.com/zalando/skipper/pull/665

The reason I think this is that we saw 500s with the following errors:

```
[APP]time="2018-06-13T00:19:33Z" level=error msg="error during backend roundtrip: kube_default__carrier_network__carrier_network_fulfillment_zalan_do____carrier_network_0: http: server closed idle connection"
[APP]time="2018-06-13T00:19:33Z" level=error msg="Failed to do backend request to http://10.2.231.92:8080: proxy error with code 0, dialing failed false, unwrap: http: server closed idle connection"
[APP]time="2018-06-13T00:19:33Z" level=error msg="error while proxying, route kube_default__carrier_network__carrier_network_fulfillment_zalan_do____carrier_network__lb_group, status code 500: proxy error with code 0, dialing failed false, unwrap: http: server closed idle connection"
```

When running v0.10.13 in our clusters and since we switched to v0.10.26: https://github.com/zalando-incubator/kubernetes-on-aws/pull/1165 we no longer see these 500s but instead 504s:

```
[APP]time="2018-06-16T16:27:47Z" level=error msg="error during backend roundtrip: kube_default__si_hyperspace__si_hyperspace_fulfillment_zalan_do____si_hyperspace_master_88_2: context canceled"
[APP]time="2018-06-16T16:27:47Z" level=error msg="Failed to do request, because of context: context canceled"
[APP]time="2018-06-16T16:27:47Z" level=error msg="Failed to do backend request to http://10.2.232.90:9000: proxy error with code 504, dialing failed false, unwrap: context canceled"
[APP]time="2018-06-16T16:27:47Z" level=error msg="error while proxying, route kube_default__si_hyperspace__si_hyperspace_fulfillment_zalan_do____si_hyperspace_master_88__lb_group, status code 504: proxy error with code 504, dialing failed false, unwrap: context canceled"
```

The error is always `context cancelled` but I suspect some of those were `http: server closed idle connection` before.

I will try to validate my theory by running latest skipper with https://github.com/zalando/skipper/pull/665 reverted.

**Comment by mikkeloscar** [comment]
Unfortunately I didn't get time to validate this theory yet.

**Comment by szuecs** [comment]
Are we sure, that the problem is not https://opensource.zalando.com/skipper/kubernetes/ingress-backends/  ?

**Comment by szuecs** [comment]
I think I found the "problem". It seems reproducible being created by the client.

the client:
```
[sszuecs@sandor-lab:~]% curl localhost:9999/ &
[1] 5571
[sszuecs@sandor-lab:~]% curl -m 1 localhost:9999/
curl: (28) Operation timed out after 1001 milliseconds with 0 bytes received
zsh: exit 28    curl -m 1 localhost:9999/
[sszuecs@sandor-lab:~]% <h1>Hello</h1>
[1]  + done       curl localhost:9999/
```

skipper proxy:
```
% ./bin/skipper --address :9999 -inline-routes 'p0: * -> "http://127.0.0.1:9090/"'
[APP]INFO[0000] Expose metrics in codahale format
[APP]INFO[0000] support listener on :9911
[APP]INFO[0000] proxy listener on :9999
[APP]INFO[0000] certPathTLS or keyPathTLS not found, defaulting to HTTP
[APP]INFO[0000] route settings, reset, route: p0: * -> "http://127.0.0.1:9090/"
[APP]INFO[0000] route settings received
[APP]INFO[0000] route settings applied
[APP]ERRO[0135] error during backend roundtrip: p0: context canceled
[APP]ERRO[0135] Failed to do request, because of context: context canceled
[APP]ERRO[0135] Failed to do backend request to http://127.0.0.1:9090/: proxy error with code 504, dialing failed false, unwrap: context canceled
[APP]ERRO[0135] error while proxying, route p0, status code 504: proxy error with code 504, dialing failed false, unwrap: context canceled
::1 - - [17/Jul/2018:13:47:40 +0200] "GET / HTTP/1.1" 504 16 "-" "curl/7.49.0" 1001 localhost:9999 - -
::1 - - [17/Jul/2018:13:47:39 +0200] "GET / HTTP/1.1" 200 14 "-" "curl/7.49.0" 5002 localhost:9999 - -
```

skipper backend:
```
% ./bin/skipper -inline-routes 'p0: * -> latency(5000) -> inlineContent("<h1>Hello</h1>") -> <shunt>'
[APP]INFO[0000] Expose metrics in codahale format
[APP]INFO[0000] support listener on :9911
[APP]INFO[0000] proxy listener on :9090
[APP]INFO[0000] certPathTLS or keyPathTLS not found, defaulting to HTTP
[APP]INFO[0000] route settings, reset, route: p0: * -> latency(5000) -> inlineContent("<h1>Hello</h1>") -> <shunt>
[APP]INFO[0000] route settings received
[APP]INFO[0000] route settings applied
127.0.0.1 - - [17/Jul/2018:13:47:39 +0200] "GET / HTTP/1.1" 200 14 "-" "curl/7.49.0" 5000 127.0.0.1:9090 - -
127.0.0.1 - - [17/Jul/2018:13:47:40 +0200] "GET / HTTP/1.1" 200 14 "-" "curl/7.49.0" 5001 127.0.0.1:9090 - -

```
packet capture for skipper proxy and the backend:
```
% tcpdump -ni any port 9999 or port 9090
tcpdump: verbose output suppressed, use -v or -vv for full protocol decode
listening on any, link-type LINUX_SLL (Linux cooked), capture size 262144 bytes


13:47:39.164751 IP6 ::1.47172 > ::1.9999: Flags [S], seq 1057269490, win 43690, options [mss 65476,sackOK,TS val 3797454020 ecr 0,nop,wscale 7], length 0
13:47:39.164772 IP6 ::1.9999 > ::1.47172: Flags [S.], seq 897656044, ack 1057269491, win 43690, options [mss 65476,sackOK,TS val 3797454020 ecr 3797454020,nop,wscale 7], length 0
13:47:39.164792 IP6 ::1.47172 > ::1.9999: Flags [.], ack 1, win 342, options [nop,nop,TS val 3797454021 ecr 3797454020], length 0
13:47:39.165077 IP6 ::1.47172 > ::1.9999: Flags [P.], seq 1:79, ack 1, win 342, options [nop,nop,TS val 3797454021 ecr 3797454020], length 78
13:47:39.165089 IP6 ::1.9999 > ::1.47172: Flags [.], ack 79, win 342, options [nop,nop,TS val 3797454021 ecr 3797454021], length 0
13:47:39.165345 IP 127.0.0.1.43128 > 127.0.0.1.9090: Flags [P.], seq 3537925555:3537925656, ack 2270640483, win 367, options [nop,nop,TS val 4078998963 ecr 4078986080], length 101
13:47:39.165362 IP 127.0.0.1.9090 > 127.0.0.1.43128: Flags [.], ack 101, win 342, options [nop,nop,TS val 4078998963 ecr 4078998963], length 0
13:47:40.221710 IP6 ::1.47362 > ::1.9999: Flags [S], seq 1569147232, win 43690, options [mss 65476,sackOK,TS val 3797455077 ecr 0,nop,wscale 7], length 0
13:47:40.221732 IP6 ::1.9999 > ::1.47362: Flags [S.], seq 1890264354, ack 1569147233, win 43690, options [mss 65476,sackOK,TS val 3797455077 ecr 3797455077,nop,wscale 7], length 0
13:47:40.221745 IP6 ::1.47362 > ::1.9999: Flags [.], ack 1, win 342, options [nop,nop,TS val 3797455077 ecr 3797455077], length 0
13:47:40.222104 IP6 ::1.47362 > ::1.9999: Flags [P.], seq 1:79, ack 1, win 342, options [nop,nop,TS val 3797455078 ecr 3797455077], length 78
13:47:40.222117 IP6 ::1.9999 > ::1.47362: Flags [.], ack 79, win 342, options [nop,nop,TS val 3797455078 ecr 3797455078], length 0
13:47:40.222430 IP 127.0.0.1.58192 > 127.0.0.1.9090: Flags [S], seq 3711981134, win 43690, options [mss 65495,sackOK,TS val 4079000020 ecr 0,nop,wscale 7], length 0
13:47:40.222451 IP 127.0.0.1.9090 > 127.0.0.1.58192: Flags [S.], seq 53914868, ack 3711981135, win 43690, options [mss 65495,sackOK,TS val 4079000020 ecr 4079000020,nop,wscale 7], length 0
13:47:40.222464 IP 127.0.0.1.58192 > 127.0.0.1.9090: Flags [.], ack 1, win 342, options [nop,nop,TS val 4079000020 ecr 4079000020], length 0
13:47:41.222575 IP6 ::1.47362 > ::1.9999: Flags [F.], seq 79, ack 1, win 342, options [nop,nop,TS val 3797456078 ecr 3797455078], length 0
13:47:41.223228 IP 127.0.0.1.58192 > 127.0.0.1.9090: Flags [F.], seq 102, ack 1, win 342, options [nop,nop,TS val 4079001021 ecr 4079000020], length 0
13:47:41.224358 IP6 ::1.9999 > ::1.47362: Flags [P.], seq 1:197, ack 80, win 342, options [nop,nop,TS val 3797456080 ecr 3797456078], length 196
13:47:41.224544 IP6 ::1.47362 > ::1.9999: Flags [R], seq 1569147312, win 0, length 0
13:47:41.266847 IP 127.0.0.1.9090 > 127.0.0.1.58192: Flags [.], ack 103, win 342, options [nop,nop,TS val 4079001062 ecr 4079001021], length 0
13:47:44.166042 IP 127.0.0.1.9090 > 127.0.0.1.43128: Flags [P.], seq 1:148, ack 101, win 342, options [nop,nop,TS val 4079003964 ecr 4078998963], length 147
13:47:44.166114 IP 127.0.0.1.43128 > 127.0.0.1.9090: Flags [.], ack 148, win 375, options [nop,nop,TS val 4079003964 ecr 4079003964], length 0
13:47:44.167259 IP6 ::1.9999 > ::1.47172: Flags [P.], seq 1:148, ack 79, win 342, options [nop,nop,TS val 3797459023 ecr 3797454021], length 147
13:47:44.167283 IP6 ::1.47172 > ::1.9999: Flags [.], ack 148, win 350, options [nop,nop,TS val 3797459023 ecr 3797459023], length 0
13:47:44.167634 IP6 ::1.47172 > ::1.9999: Flags [F.], seq 79, ack 148, win 350, options [nop,nop,TS val 3797459023 ecr 3797459023], length 0
13:47:44.169270 IP6 ::1.9999 > ::1.47172: Flags [F.], seq 148, ack 80, win 342, options [nop,nop,TS val 3797459025 ecr 3797459023], length 0
13:47:44.169302 IP6 ::1.47172 > ::1.9999: Flags [.], ack 149, win 350, options [nop,nop,TS val 3797459025 ecr 3797459025], length 0
13:47:45.223573 IP 127.0.0.1.9090 > 127.0.0.1.58192: Flags [P.], seq 1:148, ack 103, win 342, options [nop,nop,TS val 4079005021 ecr 4079001021], length 147
13:47:45.223698 IP 127.0.0.1.58192 > 127.0.0.1.9090: Flags [R], seq 3711981237, win 0, length 0
```


It's exactly this branch causing the errors https://github.com/zalando/skipper/blob/master/proxy/proxy.go#L410-L415, which will result in the proxy error with code 504, dialing failed false, unwrap: context canceled

I think we should use a 4xx status code for this case, instead of 504. I would suggest 499, because Nginx seems to use the same https://en.wikipedia.org/wiki/List_of_HTTP_status_codes#nginx

**Comment by jalateras** [comment]
@szuecs correct. I have not seen it since changing to only use etcd client

**Comment by mikkeloscar** [comment]
FYI: I'm reopening this one until we have confirmed that #708 fixes all the "false" 504s.
